{"schema":"ori.mobile_manifest.v1","app_id":"app.demo_store.api","platforms":["ios","android"],"permissions":[{"key":"network","justification":"auto-derived from declared effect http"},{"key":"database","justification":"auto-derived from declared effect db.read"}],"capabilities":["db.read","db.write","http"],"entrypoints":["sym:demo_store.api.Storefront","sym:demo_store.api.get_product","sym:demo_store.api.get_products","sym:demo_store.api.post_checkout"]}